"https://zabgu.ru/php/open_news.php?query=vnedrenie_texnologij_v_stroitel'stve&news_page=6&category=1";30 ЯНВ 2023;#наука #сотрудничество ;ЗабГУ способствует внедрению технологий в строительстве в Забайкальском крае;"27 января в Забайкальском госуниверситете проведён семинар об одном из важных направлений цифровизации отраслей строительства и ЖКХ - внедрении технологии информационного моделирования (ТИМ). Семинар был организован кафедрой строительства ЗабГУ, на базе которой действует Центр инновационно-информационных технологий в строительстве. Партнёрами мероприятия выступили компания АСКОН (входит в ТОП-100 крупнейших ИТ-компаний России и ТОП-20 крупнейших поставщиков ИТ для промышленных предприятий) и ООО «Платформа строительных сервисов» (разработчик платформы цифровых решений для строительной сферы). В семинаре приняли участие представители Минстроя Забайкальского края, госинспекции, государственной экспертизы, службы единого заказчика, 15 компаний строительной отрасли региона, преподаватели и студенты старших курсов специальности «Строительство уникальных зданий и сооружений». «Мы тесно сотрудничаем с компаниями строительной сферы, и в обсуждении общих задач пришли к выводу, что сегодня готовность большинства строительных и проектных организаций Забайкальского края к внедрению ТИМ низкая. У наших партнёров есть потребность разобраться в этой теме и внедрить её на своих предприятиях. Забайкальский госуниверситет взялся за решение этой задачи. Сегодня состоялся вводный, ознакомительный семинар, который точно не будет последним», - рассказала заведующая кафедрой строительства Марина Мершеева. В ближайшем будущем формирование и ведение информационной модели объекта капитального строительства станет обязательным требованием к застройщикам, поэтому важно уже сейчас начать процесс подготовки кадров и внедрения технологии. В 2023 году ЗабГУ при поддержке крупнейших строительных компаний региона планирует открыть лабораторию цифровых технологий в строительстве, главной задачей которой станет реализация цифровой трансформации строительной отрасли. Кафедра строительства ЗабГУ   "
https://zabgu.ru/php/open_news.php?query=lekciya_o_zhukovskom&news_page=6&category=1;30 ЯНВ 2023;#студенты #сотрудничество #интересное ;Лекцию о Жуковском провели студенты ЗабГУ;"26 января в Военно-историческом музее Дома офицеров Забайкальского края прошла лекция о жизни и творчестве поэта и переводчика Василия Жуковского. Мероприятие было проведено студентами Забайкальского госуниверситета по инициативе администрации музея. Спикером мероприятия выступил студент 4 курса историко-филологического факультета ЗабГУ Владислав Подглазов. Участниками лекции, приуроченной к 240-летию со дня рождения Василия Жуковского, одного из основоположников романтизма в русской поэзии, стали студенты Забайкальского краевого училища искусств. «Основной задачей лекции было показать, как менялась литература в первой половине XIX века и какую роль сыграл в этом Жуковский как поэт-новатор. При этом, нам хотелось, чтобы слушатели, встретив где-то это имя, представляли себе человека, а не годы жизни и несколько текстов. И, как мне кажется, нам это удалось», – поделился своим впечатлением лектор. Заведующая Военно-историческим музеем Надежда Закаблуковская отметила важность проведения подобных мероприятия и выразила надежду на дельнейшее сотрудничество с Забайкальским госуниверситетом. Владислав Подглазов, студент гр. РЛ-19 ИФФ ЗабГУ Фотографии"
https://zabgu.ru/php/open_news.php?query=itogi_internet_olimpiad&news_page=7&category=1;30 ЯНВ 2023;#студенты #поздравляем #олимпиада ;Итоги участия студентов ЗабГУ в Открытой интернет-олимпиаде;"Подведены итоги второго (заключительного) тура Открытой международной студенческой интернет-олимпиады по дисциплинам гуманитарного цикла, который проходил под эгидой Научно-исследовательского института мониторинга и качества образования и Национального фонда поддержки инноваций в сфере образования. В ЗабГУ по дисциплине «Социология» победителями олимпиады стали студентка историко-филологического факультета Татьяна Закирова и студентки энергетического факультета Анастасия Иванова и Софья Соловьёва. Они все получили бронзовые медали. По дисциплине «Правоведение» студентка юридического факультета Алёна Ерохина и студент энергетического факультета Александр Раменский также получили бронзовые медали. Награждение победителей состоялось на заседании Учёного совета ЗабГУ 26 января. Фотографии победителей публикуются на сайте Открытых международных студенческих Интернет-олимпиад в «Галерее призёров» и разделе «Победители олимпиад». Поздравляем призёров и желаем успешных свершений и новых побед! По информации Управления гарантии качества образования ЗабГУ"
"https://zabgu.ru/php/open_news.php?query=akademicheskaya_zadolzhennost'_i_eyo_likvidaciya&news_page=7&category=1";30 ЯНВ 2023;#студенты #важное ;Академическая задолженность и её ликвидация (памятка для первокурсников);"Подошла к концу зимняя сессия и впереди долгожданные каникулы, но может случиться, что вы не смогли получить зачёт или сдать экзамен на положительную оценку. В этом случае у вас образовалась академическая задолженность. В соответствии со ст. 58 Федерального закона «Об образовании в Российской Федерации» академической задолженность – это неудовлетворительные результаты промежуточной аттестации по одному или нескольким предметам при отсутствии уважительных причин. Обучающиеся обязаны её ликвидировать. Согласно Положению о текущем контроле успеваемости и промежуточной аттестации обучающихся ЗабГУ: 1. Обучающиеся, имеющие академическую задолженность, продолжают обучение в следующем семестре и имеют возможность ликвидировать задолженность (пройти повторную промежуточную аттестацию по дисциплинам) не более двух раз в сроки, определяемые деканом факультета, в пределах одного года с момента образования академической задолженности. В указанный период не включаются время болезни обучающегося, нахождение его в академическом отпуске или отпуске по беременности и родам. 2. Решение о сроках ликвидации академической задолженности обучающегося принимается деканом факультета в течение недели с момента начала следующего семестра после завершения сессии. Обучающемуся в общем отделе факультета оформляется экзаменационный лист. 3. Первая пересдача академической задолженности принимается, как правило, тем же преподавателем, который проводил экзамен (зачёт). Результаты приёма задолженности проставляются преподавателем в экзаменационном листе, который передаётся в общий отдел факультета. Кроме того, положительный результат заносится в зачётную книжку обучающегося. 4.Для проведения промежуточной аттестации по дисциплине во второй раз по представлению заведующего кафедрой, отвечающей за реализацию дисциплины (модуля), создаётся комиссия в составе трёх преподавателей. Результаты экзамена (зачёта) оформляются протоколом заседания комиссии. 5. Обучающемуся, не явившемуся на экзамен / зачёт в установленный срок по болезни или по другим уважительным причинам, подтвержденным соответствующими документами, декан факультета устанавливает индивидуальные сроки сдачи экзаменационной сессии. Обучающемуся выдаётся индивидуальная экзаменационная ведомость или экзаменационный лист. Документы, подтверждающие уважительность причин неявки на зачёт или экзамен, предоставляются обучающимися в общий отдел факультета.. Для студентов, имеющих продление сессии, период ликвидации академической задолженности устанавливается деканом после окончания срока продления сессии. Дорогие студенты, постарайтесь в кратчайшие сроки ликвидировать академическую задолженность! Помните: «Обучающиеся, не ликвидировавшие в установленные сроки академическую задолженность, отчисляются из университета как не выполнившие обязанностей по добросовестному освоению образовательной программы и выполнению учебного плана» (Федеральный закон от 29.12.2012 № 273-ФЗ «Об образовании в Российской Федерации»)! По информации Учебно-методического управления ЗабГУ"
https://zabgu.ru/php/open_news.php?query=zabgu_vuz_smeshannogo_formata&news_page=7&category=1;30 ЯНВ 2023;#образование #важное ;Забайкальский госуниверситет – вуз смешанного формата;"В ЗабГУ успешно реализуются технологии смешанного и гибридного обучения, что позволяет студентам разных категорий, в том числе с ограниченными возможностями здоровья, получить высшее образование с использованием технологий онлайн-обучения. По результатам исследования Лаборатории инноваций в образовании Института образования НИУ ВШЭ совместно с Госкорпорацией «Росатом» тренд на гибридное обучение поддержали 61,8 % российских респондентов. «Эксперты отмечают, что он зародился как вынужденная мера, а сейчас направление можно назвать хайповым. В результате пандемии процесс обучения поменялся: учителя стали чаще использовать онлайн-инструменты наряду с традиционными уроками в классе», - сказано в исследовании, результаты которого опубликованы в конце прошлого года. «Смешанный формат обучения активно используется в университете. Этот способ обучения выбирают более 90 % студентов очно-заочной формы и магистранты университета. Связано это в первую очередь со сложностями совмещения полного рабочего дня и студенческих занятий», - прокомментировала Светлана Старостина, проректор по образовательной деятельности ЗабГУ. По словам Светланы Ефимовны, смешанные формы обучения заменяют большую часть очного времени онлайн-взаимодействием, при этом качество и количество знаний не отличается от тех, что получены традиционным способом. Для выбора такого формата образования студенческая группа в начале семестра пишет заявление с просьбой разрешить проведение лекций в онлайн-режиме. Элементы гибридного обучения также используются в Забайкальском государственном университете. Гибридный формат - это смешанное обучение в специально оборудованной аудитории, форматы online и life реализуются параллельно: часть обучающихся присутствуют на занятии очно, а другая часть - с использованием технологий удалённого подключения. Смешанное обучение – это ступень к переходу на гибридное обучение, к которому стремится Забайкальский госуниверситет. Это вариант, позволяющий слушателям самим выбирать формат работы на занятиях в зависимости от удобства, прогресса в обучении, предпочтений в социальном взаимодействии или других факторов. При этом возможность для слушателей изменять формат своего участия сохраняется на протяжении всего курса. По информации Учебно-методического управления ЗабГУ"
"https://zabgu.ru/php/open_news.php?query=vstrecha_liceistov_s_dekanom_fakul'teta_zhurnalistiki_mgu&news_page=7&category=1";30 ЯНВ 2023;#образование #сотрудничество ;Лицеисты ЗабГУ встретились с деканом факультета журналистики МГУ Еленой Вартановой;"20 января для ребят из информационного сообщества ЛИС Многопрофильного лицея Забайкальского госуниверситета представилась возможность послушать лекцию профессора, академика РАО, декана факультета журналистики МГУ имени М. В. Ломоносова Елены Вартановой. В зале Учёного совета ЗабГУ группа юных журналистов из 15 представителей 8-10 классов с большим удовольствием погрузились в тему «Медиаобразование в современной школе: вызовы цифровой эпохи». Преподаватель высокого научного статуса доступно, просто и понятно изложила суть вопроса: как подготовиться к жизни в цифровой среде. Речь шла о роли медиаграмотности на современном этапе, актуальности развития навыков и способов повышения медиакультуры. Используя факты, Елена Вартанова дала понять и оценить слушателям необходимость создания информационной безопасности, а также акцентировала внимание на возможные пути получения профессии в этой сфере. Вниманию слушателей была представлена статистика медиапотребления на современном этапе, в которой лидируют социальные сети и мессенджеры. Таким образом, на социализацию личности влияют информационные потоки, которые, зачастую, представляют угрозу для воспитания и формирования нравственных качеств подрастающего поколения. Это явление Елена Леонидовна назвала «цифровыми джунглями» и, чтобы не запутаться в них, мы должны соблюдать информационную гигиену. В процессе встречи у наших лицеистов появились вопросы и желание личного общения с Еленой Ватановой. Она с большим удовольствием ответила на интересующие детей вопросы, рассказала о новых профессиях в области цифровых технологий, а также порекомендовала поучаствовать в конкурсах для школьных медиа, проводимых МГУ. Спасибо организаторам встречи и дальнейшего плодотворного сотрудничества с ведущими вузами страны! Людмила Матвеева, заместитель директора по ВР Многопрофильного лицея ЗабГУ   "
https://zabgu.ru/php/open_news.php?query=vstrecha_s_rukovoditelem_soyuza_narodov_tadzhikistana&news_page=7&category=1;27 ЯНВ 2023;#сотрудничество ;В ЗабГУ прошла встреча с руководителем «Союза народов Таджикистана»;"25 января в Забайкальском государственном университете прошла встреча проректора по развитию Ольги Еремеевой с руководителем ЗРОО «Союз Народов Таджикистана» Абдугаффором Рахимовым. В ходе встречи проректор и участники выразили заинтересованность в углублении сотрудничества и взаимодействия сторон, а также обсудили направления сотрудничества и привлечения граждан Республики Таджикистан для получения образования в Забайкальском государственном университете по различным направлениям и уровням подготовки, в том числе на бесплатной основе за счёт средств бюджета РФ в пределах квоты, установленной Правительством Российской Федерации. В настоящее время в ЗабГУ на разных факультетах обучается более 20 граждан Республики Таджикистан. Абдугаффор Рахимов в свою очередь выразил готовность в продвижении интересов ЗабГУ на территории Республики Таджикистан, в том числе по привлечению граждан для обучения в забайкальском вузе. По информации Отдела международной деятельности ЗабГУ"
